{
  "schema_version": "1.0",
  "event_id": "d4e1f6a2-9b3c-4d8e-a1f5-7c2b8e4a90d3",
  "timestamp": "2026-09-16T08:31:19Z",
  "camera_id": "gate-2-anpr",
  "solution_pack": "traffic",
  "application": "anpr",
  "event_type": "plate_read_event",
  "payload": {
    "vehicle_ref": "gate-2-anpr:run-9:14",
    "vehicle_track_id": 14,
    "vehicle": {
      "ref": "gate-2-anpr:run-9:14",
      "track_id": 14,
      "camera_id": "gate-2-anpr",
      "plate": {
        "text": "KA05MN7788",
        "confidence": 0.93
      }
    },
    "plate": {
      "text": "KA05MN7788",
      "confidence": 0.93
    },
    "location": {
      "id": "gate-2-anpr_entry",
      "name": "gate_2_anpr_entry",
      "type": "zone"
    },
    "snapshot_ref": "snapshots/gate-2-anpr/vehicle-3312.jpg",
    "snapshot_url": "/snapshots/gate-2-anpr/vehicle-3312.jpg",
    "snapshot_content_type": "image/jpeg",
    "snapshot_assets": {
      "event_frame": {
        "ref": "snapshots/gate-2-anpr/frame-3312.jpg",
        "url": "/snapshots/gate-2-anpr/frame-3312.jpg",
        "content_type": "image/jpeg"
      },
      "vehicle_crop": {
        "ref": "snapshots/gate-2-anpr/vehicle-3312.jpg",
        "url": "/snapshots/gate-2-anpr/vehicle-3312.jpg",
        "content_type": "image/jpeg"
      },
      "plate_crop": {
        "ref": "snapshots/gate-2-anpr/plate-3312.jpg",
        "url": "/snapshots/gate-2-anpr/plate-3312.jpg",
        "content_type": "image/jpeg"
      }
    }
  }
}
